{
  "case_id": "pf-fhir-agent-0004",
  "capability_id": "MR-04",
  "scoring_version": "0.1",
  "dimensions": ["CC", "SF", "TRC", "SR"],
  "options": {
    "label_fallback": false,
    "date_granularity": "day",
    "code_systems_priority": ["http://www.nlm.nih.gov/research/umls/rxnorm", "http://snomed.info/sct"]
  }
}
