{
  "case_id": "pf-fhir-agent-0900",
  "capability_id": "MR-01",
  "scoring_version": "0.1",
  "dimensions": [
    "CC",
    "TRC",
    "SR"
  ],
  "options": {
    "label_fallback": false,
    "date_granularity": "day",
    "code_systems_priority": [
      "http://www.nlm.nih.gov/research/umls/rxnorm"
    ]
  }
}
